{
	"id": "primitive.drossel",
	"name": "Drossel",
	"kind": "primitive",
	"version": "1.0.0",
	"description": "Eine Verengung, die Fluss verdichtet und nur unter hoeherem Druck sauber weitergibt.",
	"semantics": {
		"ontologyClasses": ["fluss", "potenz"],
		"processRoles": ["stauen", "ausrichten"]
	},
	"constraints": [
		"Wirkt am stabilsten in Verbindung mit einer Leitbahn.",
		"Zu weit aussen verliert sie ihre fokussierende Wirkung."
	],
	"topology": {
		"elements": [
			{
				"id": "engstelle",
				"kind": "drossel",
				"semanticRole": "drucksteigernde Engstelle",
				"ontologyClasses": ["fluss", "potenz"]
			}
		],
		"relations": [],
		"layers": [
			{ "id": "kern", "index": 0, "name": "Kernnaehe" },
			{ "id": "formung", "index": 1, "name": "Formung" },
			{ "id": "steuerung", "index": 2, "name": "Steuerung" },
			{ "id": "bindung", "index": 3, "name": "Bindung" }
		],
		"flow": { "direction": "radial-outward", "allowsReturn": false }
	},
	"geometry": {
		"space": { "kind": "core-relative", "dimensions": 2 },
		"entries": [
			{
				"ref": "element:engstelle",
				"center": { "radius": 0.38, "angleDegrees": -45 },
				"size": { "radial": 0.18, "angular": 12 },
				"rotationDegrees": -45
			}
		]
	},
	"projection2d": {
		"system": {
			"kind": "vendotic-radial",
			"layerCount": 4,
			"sectors": [
				{ "name": "auslass", "gravitativeMode": "hebend", "polarMode": "polwaerts", "rotativeMode": "fortlaufend" },
				{ "name": "lenkung", "gravitativeMode": "hebend", "polarMode": "polwaerts", "rotativeMode": "gegenlaufend" },
				{ "name": "entfaltung", "gravitativeMode": "hebend", "polarMode": "feldwaerts", "rotativeMode": "fortlaufend" },
				{ "name": "spaltung", "gravitativeMode": "hebend", "polarMode": "feldwaerts", "rotativeMode": "gegenlaufend" },
				{ "name": "praegung", "gravitativeMode": "senkend", "polarMode": "polwaerts", "rotativeMode": "fortlaufend" },
				{ "name": "siegelung", "gravitativeMode": "senkend", "polarMode": "polwaerts", "rotativeMode": "gegenlaufend" },
				{ "name": "sammlung", "gravitativeMode": "senkend", "polarMode": "feldwaerts", "rotativeMode": "fortlaufend" },
				{ "name": "begrenzung", "gravitativeMode": "senkend", "polarMode": "feldwaerts", "rotativeMode": "gegenlaufend" }
			],
			"orientationFrame": {
				"gravityReference": "up-opposes-gravity",
				"anchorReference": "outward-follows-structure",
				"notes": "Die Drossel stabilisiert Ausrichtung nur, wenn ihre Engstelle gegen den radialen Ausstrom gestellt ist."
			}
		},
		"placements": [
			{
				"ref": "element:engstelle",
				"layer": 1,
				"layerOffset": -0.1,
				"sector": "lenkung",
				"sectorOffset": 0,
				"radialSpan": 1,
				"sectorSpan": 1,
				"shapeFamily": "throat"
			}
		],
		"relationPaths": []
	}
}
